{
  "$schema": "http://json-schema.org/draft-07/schema#",
  "$id": "https://glosa.example/schema/hypothesis_selection.schema.json",
  "title": "glosa hypothesis selection",
  "description": "tier: Dr (specified; independently unreviewed). Implements templates/knowledge/hypothesis_selection.yaml (S14, founder addition HANDOFF 35d): after n LRS runs, a HUMAN compares candidate hypotheses and selects which carry forward into the genre router -- non-delegable (matches claim_card.responsible: human). An AI route may PROPOSE the comparison table, never make the selection. Namespace https://glosa.example/ is a placeholder.",
  "type": "object",
  "required": ["id", "problem_ref", "decided_by", "candidates", "selection", "cooking_log_ref"],
  "additionalProperties": true,
  "$comment": "TODO(schema.retention-direction-field, candidate_set_deltas[]): `design/SESSION_ARCH_v0.4_SPEC.md` §2.1 and `methodology/P18_session_architecture.md`'s Session-object table both name a `candidate_set_deltas[]` array as living on this file, sourced from `schema.retention-direction-field`/SA-2 -- but the DAG_v0.4 node for that proposal (`design/SESSION_ARCH_v0.4_SPEC.md` line ~239-245) lists only `retained_direction` in its `fields_added`, and no field, kernel rule, or CLI code implementing `candidate_set_deltas[]` exists anywhere in the repo (rule-10 gap fixed, ARCH_REVIEW_v0.7.json spec-code-fidelity MUST). Status: still_open / not yet specified -- no build_path assigned. Do not add this field on a guess; wait for an explicit proposal naming its shape and failing control.",
  "properties": {
    "id": { "type": "string", "pattern": "^hsel-[a-z0-9-]+-[0-9]{3}$" },
    "problem_ref": { "type": "string", "minLength": 1 },
    "decided_by": { "type": "string", "minLength": 1 },
    "decided_at": { "type": "string" },
    "session_id": {
      "description": "SESSION_ARCH_v0.4_SPEC.md §7 item 7 (schema.retention-direction-field.session-grouping-key, SA-2): the session in which `decided_at` happened, joined against schema/blackbox_note.schema.json's own `session_id`. Wiring this in is the founder's own recommended default once session.boundary-blackbox-note (SA-1) lands in the same pass -- founder ratification of §7 item 7 itself is still PENDING; until ratified, `_session_span_count` (kernel/glosa_kernel.py) only counts sessions it can actually see named here and in `chooser_reaffirmations[]`, never fabricating a count. Additive/optional.",
      "type": "string",
      "minLength": 1
    },
    "chooser_reaffirmations": {
      "description": "SESSION_ARCH_v0.4_SPEC.md §2.1 (schema.retention-direction-field, SA-2): a session reopening a previously-chosen hypothesis must have the HUMAN (not persistence) reaffirm it -- one entry per session the selection was revisited in. Additive/optional; used by kernel rule NC-77 to count session span.",
      "type": "array",
      "items": {
        "type": "object",
        "required": ["session_id", "reaffirmed_by"],
        "properties": {
          "session_id": { "type": "string", "minLength": 1 },
          "reaffirmed_by": { "$ref": "common.defs.json#/definitions/role_or_human" },
          "reaffirmed_at": { "type": "string" }
        }
      }
    },
    "retained_direction": {
      "description": "SESSION_ARCH_v0.4_SPEC.md §4 (NC-77, Family J, 'Retention != Direction'): persistence/retention of a chosen hypothesis across >=2 sessions is never by itself evidence it is expansion rather than tunnel. Default 'unknown'; a non-unknown value on a chosen row spanning >=2 sessions requires a resolvable `direction_evidence_relation` (kernel-enforced, see `_retained_direction_error`) -- schema only carries the enum/default, not the cross-field force. D-RETENTION-DIRECTION.",
      "enum": ["unknown", "expansion", "tunnel"],
      "default": "unknown"
    },
    "direction_evidence_relation": {
      "description": "SESSION_ARCH_v0.4_SPEC.md §4 NC-77's own exception clause: 'a row whose evidence_relation resolves to an existing checker/falsifier verdict -- that verdict's own sign stands'. Additive/optional; null/absent means no independent-check artifact is linked, which is exactly the condition that forces `retained_direction` to stay 'unknown' on a >=2-session chosen row.",
      "anyOf": [ { "$ref": "evidence_relation.schema.json" }, { "type": "null" } ]
    },
    "candidates": {
      "type": "array",
      "minItems": 1,
      "items": {
        "type": "object",
        "required": ["hypothesis_ref", "lrs_manifest_ref", "criteria"],
        "properties": {
          "hypothesis_ref": { "type": "string", "minLength": 1 },
          "hypothesis_world": { "type": "string" },
          "lrs_manifest_ref": { "type": "string", "minLength": 1 },
          "dialogue_table_ref": { "type": "string" },
          "criteria": {
            "type": "object",
            "properties": {
              "developability": {
                "type": "object",
                "properties": {
                  "unresolved_space_shown_by_dialogue_table": { "type": "string" },
                  "note": { "type": "string" }
                }
              },
              "access_evidence_available": {
                "type": "object",
                "properties": { "can_we_get_new_access": { "enum": ["yes", "no", "partial"] }, "note": { "type": "string" } }
              },
              "falsifier_reachable_with_our_resources": {
                "type": "object",
                "properties": { "value": { "enum": ["yes", "no", "partial"] }, "note": { "type": "string" } }
              },
              "independence_routes_available": {
                "type": "object",
                "properties": {
                  "max_reachable_independence_class": { "$ref": "common.defs.json#/definitions/independence_class" },
                  "note": { "type": "string" }
                }
              },
              "risk_and_ethics": {
                "type": "object",
                "properties": {
                  "human_participant_or_vulnerable_subject": { "enum": ["yes", "no"] },
                  "domain_safety_flags": { "type": "array", "items": { "type": "string" } },
                  "note": { "type": "string" }
                }
              },
              "genre_fit": {
                "type": "object",
                "properties": {
                  "candidate_genres": { "type": "array", "items": { "$ref": "common.defs.json#/definitions/genre" } },
                  "note": { "type": "string" }
                }
              }
            }
          },
          "accuracy_gate_at_selection_time": { "$ref": "common.defs.json#/definitions/gate_verdict" },
          "diversity_gate_at_selection_time": { "$ref": "common.defs.json#/definitions/gate_verdict" }
        }
      }
    },
    "selection": {
      "type": "object",
      "required": ["chosen", "reason"],
      "properties": {
        "chosen": { "type": "array", "items": { "type": "string" } },
        "reason": { "type": "string", "minLength": 1 },
        "parked": {
          "type": "array",
          "items": {
            "type": "object",
            "required": ["hypothesis_ref", "reason"],
            "properties": { "hypothesis_ref": { "type": "string" }, "reason": { "type": "string", "minLength": 1 } }
          }
        }
      }
    },
    "cooking_log_ref": { "type": "string", "minLength": 1 },
    "routes_to": { "type": "string" }
  },
  "allOf": [
    {
      "description": "A chosen hypothesis's routed genre must be one its own genre_fit.candidate_genres actually listed (S14 §11 'not a suggestion') -- schema checks presence of the field, not the cross-array match itself (kernel-enforced).",
      "if": { "properties": { "selection": { "type": "object", "properties": { "chosen": { "type": "array", "minItems": 1 } }, "required": ["chosen"] } } },
      "then": { "properties": { "candidates": { "type": "array", "minItems": 1 } } }
    }
  ]
}
