{
  "id": "hsel-cat-litterbox-001",
  "problem_ref": "GLOSA-PC-20260904-0001",
  "decided_by": "founder",
  "decided_at": "2026-09-06",
  "candidates": [
    {
      "hypothesis_ref": "GLOSA-CC-20260904-0001",
      "hypothesis_world": "Cats are less likely to use a litter box placed far from their sleeping/resting area.",
      "lrs_manifest_ref": "litrev-cat-litterbox-001",
      "dialogue_table_ref": "cases/worked-example-cat/dialogue_table.md",
      "criteria": {
        "developability": { "unresolved_space_shown_by_dialogue_table": "substrate/cleanliness confound not yet ruled out", "note": "" },
        "access_evidence_available": { "can_we_get_new_access": "yes", "note": "can relocate the box again" },
        "falsifier_reachable_with_our_resources": { "value": "yes", "note": "no special equipment needed" },
        "independence_routes_available": { "max_reachable_independence_class": "I3", "note": "a second household could replicate" },
        "risk_and_ethics": { "human_participant_or_vulnerable_subject": "no", "domain_safety_flags": [], "note": "" },
        "genre_fit": { "candidate_genres": ["case_study", "empirical_qual_practice"], "note": "" }
      },
      "accuracy_gate_at_selection_time": "PASS",
      "diversity_gate_at_selection_time": "PASS_WITH_LIMITS"
    }
  ],
  "selection": {
    "chosen": ["GLOSA-CC-20260904-0001"],
    "reason": "only candidate hypothesis produced so far; falsifier is reachable with household resources",
    "parked": []
  },
  "cooking_log_ref": "BB-2026-09-04-01#cooking-2",
  "routes_to": "case_study genre, per this candidate's own genre_fit list"
}
